{"schemaVersion":1,"id":"2026-au","season":2026,"round":1,"slug":"albert-park","eventCode":"au","race":{"name":"Australian Grand Prix","officialName":"Formula 1 Qatar Airways Australian Grand Prix 2026","location":"Melbourne, Australia","countryCode":"AU","startDate":"2026-03-06","endDate":"2026-03-08"},"circuit":{"trackId":"albert-park","name":"Albert Park Circuit","lengthKm":5.278,"laps":58,"raceDistanceKm":306.124,"lapRecord":{"time":"1:19.813","driver":"Charles Leclerc","year":2024},"pitStopLoss":{"seconds":21,"kind":"average"}},"compounds":[{"raceLabel":"hard","compound":"C3"},{"raceLabel":"medium","compound":"C4"},{"raceLabel":"soft","compound":"C5"}],"characteristics":{"traction":2,"braking":2,"tyreStress":3,"asphaltAbrasion":2,"asphaltGrip":2,"lateral":3,"trackEvolution":4},"setup":{"minimumStartingPressurePsi":{"front":27,"rear":24.5},"expectedRunningPressurePsi":null,"camberLimitDeg":{"front":-3.25,"rear":-1.75}},"source":{"publisher":"Pirelli","articleTitle":"Melbourne writes the first chapter of the new F1 season","articleUrl":"https://press.pirelli.com/melbourne-writes-the-first-chapter-of-the-new-f1-season/","publishedAt":"2026-03-02T12:35:09+01:00","previewAssetUrl":"https://content.presspage.com/uploads/2363/a5b68358-8cb9-43b4-b130-3b50c4e2266d/01-au26-preview-en.jpg","retrievedAt":"2026-09-30T18:14:57Z"},"provenance":{"event":{"method":"infographic-transcription","sourceUrl":"https://content.presspage.com/uploads/2363/a5b68358-8cb9-43b4-b130-3b50c4e2266d/01-au26-preview-en.jpg","retrievedAt":"2026-09-30T18:50:00Z","note":"Round from the media file name; dates from the graphic header."},"circuit":{"method":"infographic-transcription","sourceUrl":"https://content.presspage.com/uploads/2363/a5b68358-8cb9-43b4-b130-3b50c4e2266d/01-au26-preview-en.jpg","retrievedAt":"2026-09-30T18:50:00Z"},"compounds":{"method":"infographic-transcription","sourceUrl":"https://content.presspage.com/uploads/2363/a5b68358-8cb9-43b4-b130-3b50c4e2266d/01-au26-preview-en.jpg","retrievedAt":"2026-09-30T18:50:00Z"},"characteristics":{"method":"infographic-transcription","sourceUrl":"https://content.presspage.com/uploads/2363/a5b68358-8cb9-43b4-b130-3b50c4e2266d/01-au26-preview-en.jpg","retrievedAt":"2026-09-30T18:50:00Z"},"setup":{"method":"infographic-transcription","sourceUrl":"https://content.presspage.com/uploads/2363/a5b68358-8cb9-43b4-b130-3b50c4e2266d/01-au26-preview-en.jpg","retrievedAt":"2026-09-30T18:50:00Z","note":"Pirelli marks pressures as subject to change after FP2."}},"validation":{"status":"transcribed","notes":["Transcribed from the official preview graphic by an AI-assisted pass on 2026-09-30; awaiting human confirmation.","This graphic lists minimum starting pressures only (no expected running pressure)."]}}