{
  "schemaVersion": 1,
  "id": "2025-sg",
  "season": 2025,
  "round": 18,
  "slug": "marina-bay",
  "eventCode": "sg",
  "race": {
    "name": "Singapore Grand Prix",
    "officialName": "Formula 1 Singapore Airlines Singapore Grand Prix 2025",
    "location": "Singapore",
    "countryCode": "SG",
    "startDate": null,
    "endDate": null
  },
  "circuit": {
    "trackId": "marina-bay",
    "name": "Marina Bay Street Circuit",
    "lengthKm": 4.94,
    "laps": 62,
    "raceDistanceKm": 306.143,
    "lapRecord": { "time": "1:34.486", "driver": "Daniel Ricciardo", "year": 2024 },
    "pitStopLoss": null
  },
  "compounds": [
    { "raceLabel": "hard", "compound": "C3" },
    { "raceLabel": "medium", "compound": "C4" },
    { "raceLabel": "soft", "compound": "C5" }
  ],
  "characteristics": {
    "traction": 4,
    "braking": 5,
    "tyreStress": 2,
    "asphaltAbrasion": 3,
    "asphaltGrip": 3,
    "lateral": 2,
    "trackEvolution": 5,
    "downforce": 5
  },
  "setup": {
    "minimumStartingPressurePsi": { "front": 22.0, "rear": 20.0 },
    "expectedRunningPressurePsi": null,
    "camberLimitDeg": { "front": -3.25, "rear": -2.0 }
  },
  "source": {
    "publisher": "Pirelli",
    "articleTitle": "Managing the heat under the lights in Singapore",
    "articleUrl": "https://press.pirelli.com/managing-the-heat-under-the-lights-in-singapore/",
    "publishedAt": "2025-09-29T15:20:35+02:00",
    "previewAssetUrl": "https://content.presspage.com/uploads/2363/a2321f67-d943-4503-b08e-b6f45fa47773/18-sg25-preview-en.jpg",
    "retrievedAt": "2026-09-30T13:15:00Z"
  },
  "provenance": {
    "event": {
      "method": "media-filename",
      "sourceUrl": "https://content.presspage.com/uploads/2363/a2321f67-d943-4503-b08e-b6f45fa47773/18-sg25-preview-en.jpg",
      "retrievedAt": "2026-09-30T13:15:00Z",
      "note": "The 2025 infographic prints no event dates."
    },
    "circuit": {
      "method": "infographic-transcription",
      "sourceUrl": "https://content.presspage.com/uploads/2363/a2321f67-d943-4503-b08e-b6f45fa47773/18-sg25-preview-en.jpg",
      "retrievedAt": "2026-09-30T13:15:00Z",
      "note": "The 2025 infographic has no pit-stop loss."
    },
    "compounds": {
      "method": "infographic-transcription",
      "sourceUrl": "https://content.presspage.com/uploads/2363/a2321f67-d943-4503-b08e-b6f45fa47773/18-sg25-preview-en.jpg",
      "retrievedAt": "2026-09-30T13:15:00Z"
    },
    "characteristics": {
      "method": "infographic-transcription",
      "sourceUrl": "https://content.presspage.com/uploads/2363/a2321f67-d943-4503-b08e-b6f45fa47773/18-sg25-preview-en.jpg",
      "retrievedAt": "2026-09-30T13:15:00Z"
    },
    "setup": {
      "method": "infographic-transcription",
      "sourceUrl": "https://content.presspage.com/uploads/2363/a2321f67-d943-4503-b08e-b6f45fa47773/18-sg25-preview-en.jpg",
      "retrievedAt": "2026-09-30T13:15:00Z",
      "note": "The 2025 infographic lists minimum starting pressures only."
    }
  },
  "validation": {
    "status": "transcribed",
    "notes": [
      "Transcribed from the official preview infographic by an AI-assisted pass on 2026-09-30; awaiting human confirmation."
    ]
  }
}
