{"schemaVersion":1,"id":"2026-es","season":2026,"round":14,"slug":"madring","eventCode":"es","race":{"name":"Spanish Grand Prix","officialName":"Formula 1 TAG Heuer Gran Premio de España 2026","location":"Madrid, Spain","countryCode":"ES","startDate":"2026-09-11","endDate":"2026-09-13"},"circuit":{"trackId":"madring","name":"Madring","lengthKm":5.416,"laps":57,"raceDistanceKm":308.524,"lapRecord":null,"pitStopLoss":{"seconds":25,"kind":"estimate"}},"compounds":[{"raceLabel":"hard","compound":"C2"},{"raceLabel":"medium","compound":"C3"},{"raceLabel":"soft","compound":"C4"}],"characteristics":{"traction":3,"braking":3,"tyreStress":3,"asphaltAbrasion":2,"asphaltGrip":4,"lateral":4,"trackEvolution":5},"setup":{"minimumStartingPressurePsi":{"front":26.5,"rear":25.5},"expectedRunningPressurePsi":{"front":27.5,"rear":26.5},"camberLimitDeg":{"front":-2.75,"rear":-1.5}},"source":{"publisher":"Pirelli","articleTitle":"The Madring makes its World Championship debut with the challenge of the \"Monumental\"","articleUrl":"https://press.pirelli.com/the-madring-makes-its-world-championship-debut-with-the-challenge-of-the-monumental/","publishedAt":"2026-09-08T17:33:59+02:00","previewAssetUrl":"https://content.presspage.com/uploads/2363/7e5470eb-db99-4fe4-b1da-06bddd739228/14-es26-preview-en.jpg","retrievedAt":"2026-09-30T13:15:00Z"},"provenance":{"event":{"method":"infographic-transcription","sourceUrl":"https://content.presspage.com/uploads/2363/7e5470eb-db99-4fe4-b1da-06bddd739228/14-es26-preview-en.jpg","retrievedAt":"2026-09-30T13:15:00Z","note":"Dates from infographic header (11-13/09/2026)."},"circuit":{"method":"infographic-transcription","sourceUrl":"https://content.presspage.com/uploads/2363/7e5470eb-db99-4fe4-b1da-06bddd739228/14-es26-preview-en.jpg","retrievedAt":"2026-09-30T13:15:00Z","note":"Lap record shown as a dash: new circuit, no record exists."},"compounds":{"method":"infographic-transcription","sourceUrl":"https://content.presspage.com/uploads/2363/7e5470eb-db99-4fe4-b1da-06bddd739228/14-es26-preview-en.jpg","retrievedAt":"2026-09-30T13:15:00Z"},"characteristics":{"method":"infographic-transcription","sourceUrl":"https://content.presspage.com/uploads/2363/7e5470eb-db99-4fe4-b1da-06bddd739228/14-es26-preview-en.jpg","retrievedAt":"2026-09-30T13:15:00Z"},"setup":{"method":"infographic-transcription","sourceUrl":"https://content.presspage.com/uploads/2363/7e5470eb-db99-4fe4-b1da-06bddd739228/14-es26-preview-en.jpg","retrievedAt":"2026-09-30T13:15:00Z","note":"Pirelli marks pressures as subject to change after FP2."}},"validation":{"status":"transcribed","notes":["Transcribed from the official preview infographic by an AI-assisted pass on 2026-09-30; awaiting human confirmation."]}}