{"schemaVersion":1,"id":"2026-mi","season":2026,"round":4,"slug":"miami","eventCode":"mi","race":{"name":"Miami Grand Prix","officialName":"Formula 1 Crypto.com Miami Grand Prix 2026","location":"Miami, United States","countryCode":"US","startDate":"2026-05-01","endDate":"2026-05-03"},"circuit":{"trackId":"miami","name":"Miami International Autodrome","lengthKm":5.412,"laps":57,"raceDistanceKm":308.326,"lapRecord":{"time":"1:29.708","driver":"Max Verstappen","year":2023},"pitStopLoss":{"seconds":20.5,"kind":"average"}},"compounds":[{"raceLabel":"hard","compound":"C3"},{"raceLabel":"medium","compound":"C4"},{"raceLabel":"soft","compound":"C5"}],"characteristics":{"traction":3,"braking":3,"tyreStress":3,"asphaltAbrasion":3,"asphaltGrip":3,"lateral":3,"trackEvolution":5},"setup":{"minimumStartingPressurePsi":{"front":26.5,"rear":26.5},"expectedRunningPressurePsi":{"front":27,"rear":27},"camberLimitDeg":{"front":-3,"rear":-1.75}},"source":{"publisher":"Pirelli","articleTitle":"Formula 1 returns to the track in Miami","articleUrl":"https://press.pirelli.com/formula-1-returns-to-the-track-in-miami/","publishedAt":"2026-04-27T18:26:03+02:00","previewAssetUrl":"https://content.presspage.com/uploads/2363/6ab43f44-be2d-4324-bddf-03df1fefc8fa/04-mi26-preview-en.jpg","retrievedAt":"2026-09-30T18:14:57Z"},"provenance":{"event":{"method":"infographic-transcription","sourceUrl":"https://content.presspage.com/uploads/2363/6ab43f44-be2d-4324-bddf-03df1fefc8fa/04-mi26-preview-en.jpg","retrievedAt":"2026-09-30T18:45:00Z","note":"Round from the media file name; dates from the graphic header."},"circuit":{"method":"infographic-transcription","sourceUrl":"https://content.presspage.com/uploads/2363/6ab43f44-be2d-4324-bddf-03df1fefc8fa/04-mi26-preview-en.jpg","retrievedAt":"2026-09-30T18:45:00Z"},"compounds":{"method":"infographic-transcription","sourceUrl":"https://content.presspage.com/uploads/2363/6ab43f44-be2d-4324-bddf-03df1fefc8fa/04-mi26-preview-en.jpg","retrievedAt":"2026-09-30T18:45:00Z"},"characteristics":{"method":"infographic-transcription","sourceUrl":"https://content.presspage.com/uploads/2363/6ab43f44-be2d-4324-bddf-03df1fefc8fa/04-mi26-preview-en.jpg","retrievedAt":"2026-09-30T18:45:00Z"},"setup":{"method":"infographic-transcription","sourceUrl":"https://content.presspage.com/uploads/2363/6ab43f44-be2d-4324-bddf-03df1fefc8fa/04-mi26-preview-en.jpg","retrievedAt":"2026-09-30T18:45:00Z","note":"Pirelli marks pressures as subject to change after FP2."}},"validation":{"status":"transcribed","notes":["Transcribed from the official preview graphic by an AI-assisted pass on 2026-09-30; awaiting human confirmation."]}}