{
  "schemaVersion": 1,
  "id": "2026-bh",
  "season": 2026,
  "round": 16,
  "slug": "sepang",
  "eventCode": "bh",
  "race": {
    "name": "Bahrain Grand Prix",
    "officialName": "Formula 1 Gulf Air Bahrain Grand Prix in Malaysia 2026",
    "location": "Kuala Lumpur, Malaysia",
    "countryCode": "MY",
    "startDate": "2026-10-02",
    "endDate": "2026-10-04"
  },
  "circuit": {
    "trackId": "sepang",
    "name": "Sepang International Circuit",
    "lengthKm": 5.543,
    "laps": 56,
    "raceDistanceKm": 310.398,
    "lapRecord": { "time": "1:34.080", "driver": "Sebastian Vettel", "year": 2017 },
    "pitStopLoss": { "seconds": 22.5, "kind": "estimate" }
  },
  "compounds": [
    { "raceLabel": "hard", "compound": "C2" },
    { "raceLabel": "medium", "compound": "C3" },
    { "raceLabel": "soft", "compound": "C4" }
  ],
  "characteristics": {
    "traction": 3,
    "braking": 4,
    "tyreStress": 4,
    "asphaltAbrasion": 4,
    "asphaltGrip": 2,
    "lateral": 4,
    "trackEvolution": 4
  },
  "setup": {
    "minimumStartingPressurePsi": { "front": 25.0, "rear": 24.5 },
    "expectedRunningPressurePsi": { "front": 25.5, "rear": 25.0 },
    "camberLimitDeg": { "front": -3.0, "rear": -1.75 }
  },
  "source": {
    "publisher": "Pirelli",
    "articleTitle": "Sepang reopens its doors to Formula 1 after nine years",
    "articleUrl": "https://press.pirelli.com/sepang-reopens-its-doors-to-formula-1-after-nine-years/",
    "publishedAt": "2026-09-29T10:36:03+02:00",
    "previewAssetUrl": "https://content.presspage.com/uploads/2363/e36282c6-9ff8-4235-83bc-61827c1980f6/16-bh26-preview-en.jpg",
    "retrievedAt": "2026-09-30T13:15:00Z"
  },
  "provenance": {
    "event": {
      "method": "infographic-transcription",
      "sourceUrl": "https://content.presspage.com/uploads/2363/e36282c6-9ff8-4235-83bc-61827c1980f6/16-bh26-preview-en.jpg",
      "retrievedAt": "2026-09-30T13:15:00Z",
      "note": "Round from media filename; dates from infographic header (02-04/10/2026)."
    },
    "circuit": {
      "method": "infographic-transcription",
      "sourceUrl": "https://content.presspage.com/uploads/2363/e36282c6-9ff8-4235-83bc-61827c1980f6/16-bh26-preview-en.jpg",
      "retrievedAt": "2026-09-30T13:15:00Z",
      "note": "Length 5.543 km also stated in article text."
    },
    "compounds": {
      "method": "infographic-transcription",
      "sourceUrl": "https://content.presspage.com/uploads/2363/e36282c6-9ff8-4235-83bc-61827c1980f6/16-bh26-preview-en.jpg",
      "retrievedAt": "2026-09-30T13:15:00Z",
      "note": "C2/C3/C4 also stated in article text."
    },
    "characteristics": {
      "method": "infographic-transcription",
      "sourceUrl": "https://content.presspage.com/uploads/2363/e36282c6-9ff8-4235-83bc-61827c1980f6/16-bh26-preview-en.jpg",
      "retrievedAt": "2026-09-30T13:15:00Z"
    },
    "setup": {
      "method": "infographic-transcription",
      "sourceUrl": "https://content.presspage.com/uploads/2363/e36282c6-9ff8-4235-83bc-61827c1980f6/16-bh26-preview-en.jpg",
      "retrievedAt": "2026-09-30T13:15:00Z",
      "note": "Pirelli marks pressures as subject to change after FP2."
    }
  },
  "validation": {
    "status": "transcribed",
    "notes": [
      "Transcribed from the official preview infographic by an AI-assisted pass on 2026-09-30; awaiting human confirmation.",
      "The Bahrain Grand Prix, not held in April, is run at Sepang (per the Pirelli article)."
    ]
  }
}
