{
  "schemaVersion": 1,
  "id": "2026-sg",
  "season": 2026,
  "round": 17,
  "slug": "marina-bay",
  "eventCode": "sg",
  "race": {
    "name": "Singapore Grand Prix",
    "officialName": null,
    "location": "Singapore",
    "countryCode": "SG",
    "startDate": null,
    "endDate": null
  },
  "circuit": {
    "trackId": "marina-bay",
    "name": "Marina Bay Street Circuit",
    "lengthKm": null,
    "laps": null,
    "raceDistanceKm": null,
    "lapRecord": null,
    "pitStopLoss": null
  },
  "compounds": [
    {
      "raceLabel": "hard",
      "compound": "C3"
    },
    {
      "raceLabel": "medium",
      "compound": "C4"
    },
    {
      "raceLabel": "soft",
      "compound": "C5"
    }
  ],
  "characteristics": {
    "traction": null,
    "braking": null,
    "tyreStress": null,
    "asphaltAbrasion": null,
    "asphaltGrip": null,
    "lateral": null,
    "trackEvolution": null
  },
  "setup": {
    "minimumStartingPressurePsi": null,
    "expectedRunningPressurePsi": null,
    "camberLimitDeg": null
  },
  "source": {
    "publisher": "Pirelli",
    "articleTitle": "Spotlight on Singapore",
    "articleUrl": "https://press.pirelli.com/spotlight-on-singapore/",
    "publishedAt": "2026-10-06T11:10:19+02:00",
    "previewAssetUrl": "https://content.presspage.com/uploads/2363/042099e0-3f00-4cfc-a08f-cff3890808e5/17-sg26-preview-en.jpg",
    "retrievedAt": "2026-10-07T13:34:15Z"
  },
  "provenance": {
    "event": {
      "method": "media-filename",
      "sourceUrl": "https://content.presspage.com/uploads/2363/042099e0-3f00-4cfc-a08f-cff3890808e5/17-sg26-preview-en.jpg",
      "retrievedAt": "2026-10-07T13:34:15Z",
      "note": "Season and Grand Prix from article JSON-LD keywords; round and event code from the infographic file name."
    },
    "circuit": {
      "method": "article-text",
      "sourceUrl": "https://press.pirelli.com/spotlight-on-singapore/",
      "retrievedAt": "2026-10-07T13:34:15Z"
    },
    "compounds": {
      "method": "article-text",
      "sourceUrl": "https://press.pirelli.com/spotlight-on-singapore/",
      "retrievedAt": "2026-10-07T13:34:15Z"
    }
  },
  "validation": {
    "status": "needs-review",
    "notes": [
      "Automatically ingested. Not yet entered from the official graphic: race dates, laps, race distance, lap record, pit-stop loss, characteristic ratings, starting pressures, camber limits, circuit length."
    ]
  }
}
