{"schemaVersion":1,"id":"2026-be","season":2026,"round":10,"slug":"spa","eventCode":"be","race":{"name":"Belgian Grand Prix","officialName":"Formula 1 Moët & Chandon Belgian Grand Prix 2026","location":"Stavelot, Belgium","countryCode":"BE","startDate":"2026-07-17","endDate":"2026-07-19"},"circuit":{"trackId":"spa","name":"Circuit de Spa-Francorchamps","lengthKm":7.004,"laps":44,"raceDistanceKm":308.052,"lapRecord":{"time":"1:44.701","driver":"Sergio Perez","year":2024},"pitStopLoss":{"seconds":19,"kind":"average"}},"compounds":[{"raceLabel":"hard","compound":"C2"},{"raceLabel":"medium","compound":"C3"},{"raceLabel":"soft","compound":"C4"}],"characteristics":{"traction":4,"braking":4,"tyreStress":5,"asphaltAbrasion":3,"asphaltGrip":3,"lateral":5,"trackEvolution":3},"setup":{"minimumStartingPressurePsi":{"front":28,"rear":28},"expectedRunningPressurePsi":{"front":28.5,"rear":28.5},"camberLimitDeg":{"front":-2.75,"rear":-1.5}},"source":{"publisher":"Pirelli","articleTitle":"Formula 1 faces its Spa-Francorchamps exam","articleUrl":"https://press.pirelli.com/formula-1-faces-its-spa-francorchamps-exam/","publishedAt":"2026-07-15T11:23:00+02:00","previewAssetUrl":"https://content.presspage.com/uploads/2363/9d732a6a-39e5-472a-963e-934140d5c7a4/10-be26-preview-en.jpg","retrievedAt":"2026-09-30T18:14:57Z"},"provenance":{"event":{"method":"infographic-transcription","sourceUrl":"https://content.presspage.com/uploads/2363/9d732a6a-39e5-472a-963e-934140d5c7a4/10-be26-preview-en.jpg","retrievedAt":"2026-09-30T18:30:00Z","note":"Round from the media file name; dates from the graphic header."},"circuit":{"method":"infographic-transcription","sourceUrl":"https://content.presspage.com/uploads/2363/9d732a6a-39e5-472a-963e-934140d5c7a4/10-be26-preview-en.jpg","retrievedAt":"2026-09-30T18:30:00Z"},"compounds":{"method":"infographic-transcription","sourceUrl":"https://content.presspage.com/uploads/2363/9d732a6a-39e5-472a-963e-934140d5c7a4/10-be26-preview-en.jpg","retrievedAt":"2026-09-30T18:30:00Z"},"characteristics":{"method":"infographic-transcription","sourceUrl":"https://content.presspage.com/uploads/2363/9d732a6a-39e5-472a-963e-934140d5c7a4/10-be26-preview-en.jpg","retrievedAt":"2026-09-30T18:30:00Z"},"setup":{"method":"infographic-transcription","sourceUrl":"https://content.presspage.com/uploads/2363/9d732a6a-39e5-472a-963e-934140d5c7a4/10-be26-preview-en.jpg","retrievedAt":"2026-09-30T18:30:00Z","note":"Pirelli marks pressures as subject to change after FP2."}},"validation":{"status":"transcribed","notes":["Transcribed from the official preview graphic by an AI-assisted pass on 2026-09-30; awaiting human confirmation."]}}