{
  "schemaVersion": 1,
  "id": "2025-ae",
  "season": 2025,
  "round": 24,
  "slug": "yas-marina",
  "eventCode": "ae",
  "race": {
    "name": "Abu Dhabi Grand Prix",
    "officialName": "Formula 1 Etihad Airways Abu Dhabi Grand Prix 2025",
    "location": "Abu Dhabi, United Arab Emirates",
    "countryCode": "AE",
    "startDate": null,
    "endDate": null
  },
  "circuit": {
    "trackId": "yas-marina",
    "name": "Yas Marina Circuit",
    "lengthKm": 5.281,
    "laps": 58,
    "raceDistanceKm": 306.183,
    "lapRecord": { "time": "1:25.637", "driver": "Kevin Magnussen", "year": 2024 },
    "pitStopLoss": null
  },
  "compounds": [
    { "raceLabel": "hard", "compound": "C3" },
    { "raceLabel": "medium", "compound": "C4" },
    { "raceLabel": "soft", "compound": "C5" }
  ],
  "characteristics": {
    "traction": 4,
    "braking": 4,
    "tyreStress": 3,
    "asphaltAbrasion": 3,
    "asphaltGrip": 3,
    "lateral": 3,
    "trackEvolution": 4,
    "downforce": 3
  },
  "setup": {
    "minimumStartingPressurePsi": { "front": 23.5, "rear": 21.5 },
    "expectedRunningPressurePsi": null,
    "camberLimitDeg": { "front": -3.0, "rear": -2.0 }
  },
  "source": {
    "publisher": "Pirelli",
    "articleTitle": "In Abu Dhabi for a first step towards the F1 of the future",
    "articleUrl": "https://press.pirelli.com/in-abu-dhabi-for-a-first-step-towards-the-f1-of-the-future/",
    "publishedAt": "2025-12-02T09:35:22+01:00",
    "previewAssetUrl": "https://content.presspage.com/uploads/2363/8848ac07-ae6e-486e-8495-aac6e018aa7a/24-ae25-preview-en.jpg",
    "retrievedAt": "2026-09-30T13:15:00Z"
  },
  "provenance": {
    "event": {
      "method": "media-filename",
      "sourceUrl": "https://content.presspage.com/uploads/2363/8848ac07-ae6e-486e-8495-aac6e018aa7a/24-ae25-preview-en.jpg",
      "retrievedAt": "2026-09-30T13:15:00Z",
      "note": "The 2025 infographic prints no event dates."
    },
    "circuit": {
      "method": "infographic-transcription",
      "sourceUrl": "https://content.presspage.com/uploads/2363/8848ac07-ae6e-486e-8495-aac6e018aa7a/24-ae25-preview-en.jpg",
      "retrievedAt": "2026-09-30T13:15:00Z",
      "note": "The 2025 infographic has no pit-stop loss."
    },
    "compounds": {
      "method": "infographic-transcription",
      "sourceUrl": "https://content.presspage.com/uploads/2363/8848ac07-ae6e-486e-8495-aac6e018aa7a/24-ae25-preview-en.jpg",
      "retrievedAt": "2026-09-30T13:15:00Z",
      "note": "C3/C4/C5 also stated in article text."
    },
    "characteristics": {
      "method": "infographic-transcription",
      "sourceUrl": "https://content.presspage.com/uploads/2363/8848ac07-ae6e-486e-8495-aac6e018aa7a/24-ae25-preview-en.jpg",
      "retrievedAt": "2026-09-30T13:15:00Z"
    },
    "setup": {
      "method": "infographic-transcription",
      "sourceUrl": "https://content.presspage.com/uploads/2363/8848ac07-ae6e-486e-8495-aac6e018aa7a/24-ae25-preview-en.jpg",
      "retrievedAt": "2026-09-30T13:15:00Z",
      "note": "The 2025 infographic lists minimum starting pressures only."
    }
  },
  "validation": {
    "status": "transcribed",
    "notes": [
      "Transcribed from the official preview infographic by an AI-assisted pass on 2026-09-30; awaiting human confirmation."
    ]
  }
}
