{"schemaVersion":1,"id":"2026-mc","season":2026,"round":6,"slug":"monaco","eventCode":"mc","race":{"name":"Monaco Grand Prix","officialName":"Formula 1 Louis Vuitton Grand Prix de Monaco 2026","location":"Monte Carlo, Monaco","countryCode":"MC","startDate":"2026-06-05","endDate":"2026-06-07"},"circuit":{"trackId":"monaco","name":"Circuit de Monaco","lengthKm":3.337,"laps":78,"raceDistanceKm":260.286,"lapRecord":{"time":"1:12.909","driver":"Lewis Hamilton","year":2021},"pitStopLoss":{"seconds":21,"kind":"average"}},"compounds":[{"raceLabel":"hard","compound":"C3"},{"raceLabel":"medium","compound":"C4"},{"raceLabel":"soft","compound":"C5"}],"characteristics":{"traction":5,"braking":2,"tyreStress":1,"asphaltAbrasion":1,"asphaltGrip":2,"lateral":1,"trackEvolution":5},"setup":{"minimumStartingPressurePsi":{"front":24,"rear":23},"expectedRunningPressurePsi":{"front":24.5,"rear":23.5},"camberLimitDeg":{"front":-3.25,"rear":-2.25}},"source":{"publisher":"Pirelli","articleTitle":"The jewel of Formula 1: history and glamour at the Monaco GP","articleUrl":"https://press.pirelli.com/the-jewel-of-formula-1-history-and-glamour-at-the-monaco-gp/","publishedAt":"2026-06-02T14:12:48+02:00","previewAssetUrl":"https://content.presspage.com/uploads/2363/36ebad24-6c1c-41f1-b226-2fa0d59e0e55/05-mc26-preview-en.jpg","retrievedAt":"2026-09-30T18:14:57Z"},"provenance":{"event":{"method":"infographic-transcription","sourceUrl":"https://content.presspage.com/uploads/2363/36ebad24-6c1c-41f1-b226-2fa0d59e0e55/05-mc26-preview-en.jpg","retrievedAt":"2026-09-30T18:45:00Z","note":"Pirelli's media file is named 05-mc26 (the same round as 05-ca26); round 6 follows from the Pirelli 2026 calendar order (Montreal, Monaco, Barcelona = 07-bc26). Dates from the graphic header."},"circuit":{"method":"infographic-transcription","sourceUrl":"https://content.presspage.com/uploads/2363/36ebad24-6c1c-41f1-b226-2fa0d59e0e55/05-mc26-preview-en.jpg","retrievedAt":"2026-09-30T18:45:00Z"},"compounds":{"method":"infographic-transcription","sourceUrl":"https://content.presspage.com/uploads/2363/36ebad24-6c1c-41f1-b226-2fa0d59e0e55/05-mc26-preview-en.jpg","retrievedAt":"2026-09-30T18:45:00Z"},"characteristics":{"method":"infographic-transcription","sourceUrl":"https://content.presspage.com/uploads/2363/36ebad24-6c1c-41f1-b226-2fa0d59e0e55/05-mc26-preview-en.jpg","retrievedAt":"2026-09-30T18:45:00Z"},"setup":{"method":"infographic-transcription","sourceUrl":"https://content.presspage.com/uploads/2363/36ebad24-6c1c-41f1-b226-2fa0d59e0e55/05-mc26-preview-en.jpg","retrievedAt":"2026-09-30T18:45:00Z","note":"Pirelli marks pressures as subject to change after FP2."}},"validation":{"status":"transcribed","notes":["Transcribed from the official preview graphic by an AI-assisted pass on 2026-09-30; awaiting human confirmation.","The graphic header reads 05-07/2026 without a month; June is taken from the Pirelli F1 calendar (5 Jun - 7 Jun)."]}}