{"schemaVersion":1,"id":"2026-gb","season":2026,"round":9,"slug":"silverstone","eventCode":"gb","race":{"name":"British Grand Prix","officialName":"Formula 1 Pirelli British Grand Prix 2026","location":"Silverstone, United Kingdom","countryCode":"GB","startDate":"2026-07-03","endDate":"2026-07-05"},"circuit":{"trackId":"silverstone","name":"Silverstone Circuit","lengthKm":5.891,"laps":52,"raceDistanceKm":306.198,"lapRecord":{"time":"1:27.097","driver":"Max Verstappen","year":2020},"pitStopLoss":{"seconds":20,"kind":"average"}},"compounds":[{"raceLabel":"hard","compound":"C1"},{"raceLabel":"medium","compound":"C2"},{"raceLabel":"soft","compound":"C3"}],"characteristics":{"traction":3,"braking":2,"tyreStress":5,"asphaltAbrasion":2,"asphaltGrip":4,"lateral":5,"trackEvolution":2},"setup":{"minimumStartingPressurePsi":{"front":28,"rear":26},"expectedRunningPressurePsi":{"front":28.5,"rear":26.5},"camberLimitDeg":{"front":-2.75,"rear":-1.5}},"source":{"publisher":"Pirelli","articleTitle":"The challenges of Silverstone, the cradle of motorsport","articleUrl":"https://press.pirelli.com/the-challenges-of-silverstone-the-cradle-of-motorsport/","publishedAt":"2026-06-30T16:28:12+02:00","previewAssetUrl":"https://content.presspage.com/uploads/2363/451586f7-ad2c-43e5-9d50-1d4420b7fdf2/09-gb26-preview-en.jpg","retrievedAt":"2026-09-30T18:14:57Z"},"provenance":{"event":{"method":"infographic-transcription","sourceUrl":"https://content.presspage.com/uploads/2363/451586f7-ad2c-43e5-9d50-1d4420b7fdf2/09-gb26-preview-en.jpg","retrievedAt":"2026-09-30T18:30:00Z","note":"Round from the media file name; dates from the graphic header."},"circuit":{"method":"infographic-transcription","sourceUrl":"https://content.presspage.com/uploads/2363/451586f7-ad2c-43e5-9d50-1d4420b7fdf2/09-gb26-preview-en.jpg","retrievedAt":"2026-09-30T18:30:00Z"},"compounds":{"method":"infographic-transcription","sourceUrl":"https://content.presspage.com/uploads/2363/451586f7-ad2c-43e5-9d50-1d4420b7fdf2/09-gb26-preview-en.jpg","retrievedAt":"2026-09-30T18:30:00Z"},"characteristics":{"method":"infographic-transcription","sourceUrl":"https://content.presspage.com/uploads/2363/451586f7-ad2c-43e5-9d50-1d4420b7fdf2/09-gb26-preview-en.jpg","retrievedAt":"2026-09-30T18:30:00Z"},"setup":{"method":"infographic-transcription","sourceUrl":"https://content.presspage.com/uploads/2363/451586f7-ad2c-43e5-9d50-1d4420b7fdf2/09-gb26-preview-en.jpg","retrievedAt":"2026-09-30T18:30:00Z","note":"Pirelli marks pressures as subject to change after FP2."}},"validation":{"status":"transcribed","notes":["Transcribed from the official preview graphic by an AI-assisted pass on 2026-09-30; awaiting human confirmation."]}}